{
  "camera_id": "CAMERA_EP01_S06_SH005_V01",
  "shot_id": "EP01_S06_SH005",
  "lens": 35,
  "camera_height": 1.5,
  "duration": 6,
  "fps": 24,
  "motion": {
    "type": "dolly_forward",
    "distance": 2,
    "degrees": null,
    "speed_curve": "linear"
  },
  "tilt": {
    "start": 0,
    "end": 0
  },
  "target": "CHAR_SILLA_ELITE_OBSERVER_01",
  "actor_positions": [
    {
      "character_id": "CHAR_SILLA_ELITE_OBSERVER_01",
      "x": 0.0,
      "y": 2.5,
      "z": 0.0,
      "facing_deg": 0
    }
  ],
  "height_ratios": {
    "CHAR_SILLA_ELITE_OBSERVER_01": 1.0,
    "CHAR_SILLA_LABORER_GROUP_01": 0.97,
    "CHAR_SILLA_ATTENDANT_GROUP_01": 0.98
  },
  "blender_file": null,
  "version": "V01",
  "status": "DRAFT",
  "updated_at": "2026-09-11"
}
